{
  "startedAt": "2026-09-13T14:44:29.185276784Z",
  "dboVersion": "a8d0c25d",
  "machine": {
    "model": "Raspberry Pi 5 Model B Rev 1.0",
    "memoryKb": 8147588,
    "kernel": "Linux 6.12.85-0-rpi",
    "profile": "existing",
    "postgres": "17.10",
    "jdk": "Alpine 21.0.11"
  },
  "thermal": {
    "available": true,
    "maxSocTempC": 65.9,
    "throttledSinceBoot": false,
    "underVoltageSinceBoot": false
  },
  "valid": true,
  "tenants": 2,
  "failures": {
    "total": 0,
    "byStatus": {}
  },
  "measurements": {
    "write": {
      "count": 2414,
      "perSecond": 20.137,
      "p50": 51.823,
      "p95": 60.081,
      "p99": 75.934,
      "max": 803.669
    },
    "tokenLookup": {
      "count": 2413,
      "perSecond": 20.133,
      "p50": 47.584,
      "p95": 51.93,
      "p99": 52.443,
      "max": 75.426
    },
    "feedLagMs": {
      "p50": 15.92,
      "p99": 36.712,
      "max": 771.189,
      "samples": 2416
    },
    "stepPhasesMs": {
      "retrieve": {
        "count": 400,
        "perSecond": 29.366,
        "p50": 0.754,
        "p95": 1.239,
        "p99": 1.865,
        "max": 7.211
      },
      "execute": {
        "count": 400,
        "perSecond": 29.366,
        "p50": 0.019,
        "p95": 0.023,
        "p99": 0.037,
        "max": 0.959
      },
      "write": {
        "count": 400,
        "perSecond": 29.366,
        "p50": 10.727,
        "p95": 14.837,
        "p99": 20.021,
        "max": 22.229
      },
      "whole": {
        "count": 400,
        "perSecond": 29.366,
        "p50": 11.473,
        "p95": 16.135,
        "p99": 21.694,
        "max": 29.514
      }
    },
    "coldStartMs": 7410
  }
}
